{"version":"1.0","case_id":"medium_0011","seed":1,"path":[[93,65],[92,65],[91,64],[91,63],[91,62],[91,61],[91,60],[91,59],[91,58],[90,57],[89,58],[89,59],[89,60],[89,61],[89,62],[88,63],[87,62],[87,61],[87,60],[87,59],[87,58],[86,57],[85,57],[84,57],[83,56],[82,55],[81,55],[80,55],[79,55],[78,55],[77,54],[77,53],[77,52],[78,51],[79,50],[78,49],[77,49],[76,49],[75,48],[75,47],[75,46],[74,45],[73,46],[73,47],[73,48],[73,49],[73,50],[74,51],[75,52],[75,53],[75,54],[75,55],[75,56],[76,57],[77,58],[76,59],[75,60],[75,61],[75,62],[76,63],[77,62],[78,61],[79,60],[79,59],[79,58],[80,57],[81,58],[82,59],[83,59],[84,59],[85,60],[84,61],[83,62],[83,63],[83,64],[84,65],[85,66],[86,67],[87,68],[88,69],[89,70],[89,71],[89,72],[89,73],[89,74],[89,75],[89,76],[90,77],[91,78],[90,79],[89,79],[88,79],[87,79],[86,79],[85,79],[84,79],[83,79],[82,79],[81,78],[82,77],[83,77],[84,77],[85,77],[86,77],[87,76],[87,75],[87,74],[86,73],[85,73],[84,73],[83,72],[84,71],[85,70],[84,69],[83,68],[82,67],[81,67],[80,67],[79,66],[78,65],[77,65],[76,65],[75,66],[75,67],[75,68],[76,69],[77,70],[76,71],[75,71],[74,71],[73,72],[74,73],[75,74],[75,75],[75,76],[74,77],[73,76],[72,75],[71,76],[70,77],[69,76],[69,75],[69,74],[69,73],[69,72],[69,71],[69,70],[69,69],[69,68],[69,67],[69,66],[69,65],[69,64],[70,63],[71,64],[72,65],[73,64],[73,63],[73,62],[72,61],[71,61],[70,61],[69,60],[69,59],[69,58],[69,57],[69,56],[68,55],[67,54],[66,53],[65,54],[64,55],[63,56],[63,57],[63,58],[63,59],[63,60],[62,61],[61,60],[61,59],[61,58],[61,57],[61,56],[61,55],[61,54],[62,53],[63,52],[62,51],[61,50],[61,49],[61,48],[62,47],[63,47],[64,47],[65,46],[64,45],[63,44],[64,43],[65,43],[66,43],[67,42],[66,41],[65,40],[64,39],[63,38],[62,37],[61,38],[61,39],[61,40],[60,41],[59,40],[58,39],[57,39],[56,39],[55,39],[54,39],[53,39],[52,39],[51,38],[51,37],[51,36],[52,35],[53,36],[54,37],[55,37],[56,37],[57,37],[58,37],[59,36],[59,35],[59,34],[60,33],[61,33],[62,33],[63,33],[64,33],[65,33],[66,33],[67,33],[68,33],[69,34],[68,35],[67,36],[67,37],[67,38],[68,39],[69,39],[70,39],[71,38],[71,37],[71,36],[72,35],[73,35],[74,35],[75,35],[76,35],[77,34],[76,33],[75,33],[74,33],[73,32],[72,31],[71,31],[70,31],[69,31],[68,31],[67,31],[66,31],[65,30],[64,29],[63,28],[63,27],[63,26],[63,25],[63,24],[62,23],[61,22],[62,21],[63,21],[64,21],[65,22],[65,23],[65,24],[66,25],[67,24],[68,23],[69,23],[70,23],[71,23],[72,23],[73,23],[74,23],[75,23],[76,23],[77,22],[76,21],[75,21],[74,21],[73,20],[74,19],[75,18],[75,17],[75,16],[76,15],[77,14],[76,13],[75,12],[76,11],[77,10],[78,9],[79,8],[78,7],[77,6],[76,5],[75,6],[75,7],[75,8],[74,9],[73,9],[72,9],[71,9],[70,9],[69,9],[68,9],[67,8],[68,7],[69,7],[70,7],[71,7],[72,7],[73,6],[72,5],[71,5],[70,5],[69,5],[68,5],[67,4],[66,3],[65,4],[65,5],[65,6],[65,7],[65,8],[64,9],[63,10],[64,11],[65,11],[66,11],[67,11],[68,11],[69,12],[68,13],[67,13],[66,13],[65,13],[64,13],[63,13],[62,13],[61,14],[60,15],[59,14],[58,13],[57,14],[57,15],[57,16],[57,17],[57,18],[56,19],[55,19],[54,19],[53,19],[52,19],[51,18],[50,17],[49,16],[48,15],[47,15],[46,15],[45,15],[44,15],[43,16],[43,17],[43,18],[43,19],[43,20],[42,21],[41,22],[42,23],[43,24],[43,25],[43,26],[42,27],[41,26],[40,25],[39,26],[38,27],[37,28],[38,29],[39,30],[40,31],[41,32],[40,33],[39,34],[39,35],[39,36],[40,37],[41,36],[42,35],[43,35],[44,35],[45,36],[44,37],[43,38],[44,39],[45,40],[45,41],[45,42],[45,43],[45,44],[44,45],[43,45],[42,45],[41,45],[40,45],[39,46],[40,47],[41,48],[42,49],[43,48],[44,47],[45,47],[46,47],[47,48],[47,49],[47,50],[48,51],[49,52],[50,53],[51,54],[51,55],[51,56],[50,57],[49,58],[48,59],[47,59],[46,59],[45,60],[44,61],[43,62],[42,63],[41,64],[40,65],[39,65],[38,65],[37,65],[36,65],[35,66],[36,67],[37,68],[36,69],[35,70],[36,71],[37,72],[37,73],[37,74],[36,75],[35,76],[34,77],[33,77],[32,77],[31,78],[30,79],[29,78],[29,77],[29,76],[28,75],[27,76],[26,77],[25,76],[24,75],[23,76],[22,77],[21,78],[20,79],[19,79],[18,79],[17,78],[17,77],[17,76],[16,75],[15,76],[14,77],[13,78],[12,79],[11,79],[10,79],[9,79],[8,79],[7,78],[6,77],[5,78],[4,79],[3,78],[3,77],[3,76],[2,75],[1,74],[2,73],[3,72],[4,71],[5,70],[6,69],[7,68],[8,67],[9,67],[10,67],[11,67],[12,67],[13,67],[14,67],[15,67],[16,67],[17,67],[18,67],[19,68],[19,69],[19,70],[19,71],[19,72],[20,73],[21,72],[21,71],[21,70],[21,69],[21,68],[22,67],[23,67],[24,67],[25,68],[24,69],[23,70],[24,71],[25,72],[26,73],[27,73],[28,73],[29,73],[30,73],[31,73],[32,73],[33,72],[32,71],[31,71],[30,71],[29,71],[28,71],[27,70],[27,69],[27,68],[28,67],[29,66],[28,65],[27,65],[26,65],[25,65],[24,65],[23,65],[22,65],[21,64],[21,63],[21,62],[20,61],[19,62],[19,63],[19,64],[18,65],[17,65],[16,65],[15,65],[14,65],[13,65],[12,65],[11,65],[10,65],[9,64],[9,63],[9,62],[9,61],[9,60],[9,59],[9,58],[10,57],[11,56],[12,55],[13,55],[14,55],[15,54],[16,53],[17,54],[18,55],[19,55],[20,55],[21,55],[22,55],[23,56],[22,57],[21,58],[22,59],[23,60],[23,61],[23,62],[24,63],[25,62],[25,61],[25,60],[25,59],[25,58],[26,57],[27,56],[27,55],[27,54],[26,53],[25,53],[24,53],[23,52],[24,51],[25,51],[26,51],[27,51],[28,51],[29,51],[30,51],[31,51],[32,51],[33,50],[33,49],[33,48],[33,47],[33,46],[34,45],[35,44],[35,43],[35,42],[35,41],[35,40],[35,39],[35,38],[36,37],[37,36],[37,35],[37,34],[36,33],[35,32],[34,31],[33,30],[32,29],[31,30],[31,31],[31,32],[31,33],[31,34],[31,35],[31,36],[30,37],[29,36],[28,35],[27,36],[27,37]]}