{"version":"1.0","case_id":"easy_0013","seed":2,"path":[[51,9],[50,9],[49,9],[48,9],[47,10],[46,11],[45,12],[44,12],[43,12],[42,12],[41,12],[40,13],[39,14],[38,15],[37,16],[38,17],[39,17],[40,18],[41,19],[41,20],[41,21],[41,22],[41,23],[41,24],[41,25],[41,26],[41,27],[41,28],[41,29],[41,30],[41,31],[41,32],[41,33],[41,34],[41,35],[41,36],[41,37],[40,38],[40,39],[41,40]]}