{"version":"1.0","case_id":"hard_0034","seed":2,"path":[[54,27],[55,27],[56,28],[57,29],[58,30],[59,31],[60,31],[61,31],[62,31],[63,31],[64,32],[65,33],[66,34],[66,35],[67,36],[68,36],[69,37],[70,38],[71,39],[72,40],[73,40],[74,40],[75,41],[76,42],[77,43],[78,43],[79,44],[80,45],[81,46],[82,47],[83,48],[84,49],[85,50],[86,51],[86,52],[87,53],[88,54],[88,55],[89,56],[90,56],[91,57],[92,58],[93,59],[94,60],[94,61],[94,62],[95,63],[96,63],[97,64],[98,65],[99,66],[100,67],[101,68],[102,68],[103,68],[104,69],[105,70],[106,71],[107,72],[108,73],[109,73],[110,74],[111,74],[112,75],[113,76],[114,76],[115,77],[116,78],[117,79],[118,80],[119,81],[120,82],[120,83],[121,84],[122,85],[123,86],[124,87],[125,87],[126,88],[127,89],[128,90],[129,91],[130,92],[131,92],[132,93],[133,93],[134,93],[135,94],[136,94],[137,94],[138,95],[139,96],[140,97],[141,98],[142,98],[143,99],[144,100],[145,101],[146,102],[147,103],[148,104],[149,104],[150,104],[151,105],[152,106],[153,107],[154,108],[155,109],[156,110],[157,111],[158,111],[159,112],[160,113],[161,113],[162,113],[163,114],[164,115],[165,116],[166,117],[167,118],[168,119],[169,120],[170,121],[171,122],[172,123],[173,124],[174,124],[175,125],[176,125],[177,126],[178,126],[179,126],[180,127],[181,128],[182,129],[183,129],[184,129],[185,129],[186,129],[187,130],[188,131],[189,132],[190,133],[191,133],[192,134],[192,135]]}